<?xml version="1.0" encoding="utf-8"?><!-- Copyright (c) 2016, WSO2 Inc. (http://www.wso2.org) All Rights Reserved. Licensed under the Apache License, Version 2.0 (the "License"); you may not use this file except in compliance with the License. You may obtain a copy of the License at http://www.apache.org/licenses/LICENSE-2.0 Unless required by applicable law or agreed to in writing, software distributed under the License is distributed on an "AS IS" BASIS, WITHOUT WARRANTIES OR CONDITIONS OF ANY KIND, either express or implied. See the License for the specific language governing permissions and limitations under the License.--><AppServer xmlns:xsi="http://www.w3.org/2001/XMLSchema-instance" xmlns="http://wso2.org/2016/wso2as"           xsi:schemaLocation="http://wso2.org/2016/wso2as wso2as.xsd">    <!--        Defines the server level configurations for classloader runtime environments, which enable the        storage of runtime libraries required by your web applications in a central repository.    -->    <ClassLoader>        <Environments>            <Environment>                <Name>CUSTOM</Name>                <Classpath>${catalina.home}/lib/runtimes/custom/</Classpath>            </Environment>        </Environments>    </ClassLoader>    <SAML2SingleSignOn>        <IdPURL>https://localhost:9443/samlsso</IdPURL>        <IdPEntityId>localhost</IdPEntityId>        <IdPCertificateAlias>wso2carbon</IdPCertificateAlias>        <AssertionConsumerServiceBase>https://localhost:8443</AssertionConsumerServiceBase>    </SAML2SingleSignOn>    <Security>        <KeyStore>            <Location>${catalina.base}/conf/wso2/wso2carbon.jks</Location>            <Type>JKS</Type>            <Password>wso2carbon</Password>            <KeyAlias>wso2carbon</KeyAlias>            <KeyPassword>wso2carbon</KeyPassword>        </KeyStore>        <TrustStore>            <Location>${catalina.base}/conf/wso2/client-truststore.jks</Location>            <Type>JKS</Type>            <Password>wso2carbon</Password>        </TrustStore>    </Security></AppServer>