<?xml version="1.0" encoding="utf-8"?><!--  ~  Copyright (c) 2016, WSO2 Inc. (http://www.wso2.org) All Rights Reserved.  ~  ~  WSO2 Inc. licenses this file to you under the Apache License,  ~  Version 2.0 (the "License"); you may not use this file except  ~  in compliance with the License.  ~  You may obtain a copy of the License at  ~  ~  http://www.apache.org/licenses/LICENSE-2.0  ~  ~ Unless required by applicable law or agreed to in writing,  ~  software distributed under the License is distributed on an  ~  "AS IS" BASIS, WITHOUT WARRANTIES OR CONDITIONS OF ANY  ~  KIND, either express or implied. See the License for the  ~  specific language governing permissions and limitations  ~  under the License.  ~  --><AppServer xmlns:xsi="http://www.w3.org/2001/XMLSchema-instance" xmlns="http://wso2.org/2016/wso2as"           xsi:schemaLocation="http://wso2.org/2016/wso2as wso2as.xsd">    <ClassLoader>        <Environments>            <Environment>                <Name>Env1</Name>                <Classpath>${catalina.home}/lib/runtimes/env1/</Classpath>            </Environment>            <Environment>                <Name>Env2</Name>                <Classpath>${catalina.home}/lib/runtimes/env2/</Classpath>            </Environment>        </Environments>    </ClassLoader>    <SAML2SingleSignOn>        <IdPURL>https://localhost:9443/samlsso</IdPURL>        <IdPEntityId>localhost</IdPEntityId>        <SignatureValidatorImplClass>org.wso2.appserver.webapp.security.signature.SAMLSignatureValidatorImplementation        </SignatureValidatorImplClass>        <IdPCertificateAlias>wso2carbon</IdPCertificateAlias>    </SAML2SingleSignOn>    <StatisticsPublisher>        <Username>admin</Username>        <Password>admin</Password>        <AuthenticationURL>ssl://127.0.0.1:7611</AuthenticationURL>        <PublisherURL>tcp://127.0.0.1:7611</PublisherURL>        <StreamId>org.wso2.http.stat:1.0.0</StreamId>    </StatisticsPublisher>    <Security>        <KeyStore>            <Location>${catalina.base}/keystore.jks</Location>            <Type>JKS</Type>            <Password>wso2carbon</Password>            <KeyAlias>wso2carbon</KeyAlias>            <KeyPassword>wso2carbon</KeyPassword>        </KeyStore>        <TrustStore>            <Location>${catalina.base}/client-truststore.jks</Location>            <Type>JKS</Type>            <Password>wso2carbon</Password>        </TrustStore>    </Security></AppServer>